,Hospital Name,Title 1,Link 1,Population Health 1,Title 2,Link 2,Population Health 2,Title 3,Link 3,Population Health 3
0,CHATUGE REGIONAL HOSPITAL,Senior Leadership - Union General Health System,https://uniongeneralhealthsystem.com/senior-leadership/,"Unusual behavior notice: Webpage: 
 Error fetching webpage: HTTPSConnectionPool(host='r.jina.ai', port=443): Max retries exceeded with url: /https://uniongeneralhealthsystem.com/senior-leadership/ (Caused by SSLError(SSLCertVerificationError(1, ""[SSL: CERTIFICATE_VERIFY_FAILED] certificate verify failed: Hostname mismatch, certificate is not valid for 'r.jina.ai'. (_ssl.c:1000)""))).",Georgia Hospital Association > Advocacy > Rural Health Care,https://www.gha.org/Advocacy/Rural-Health-Care,"Unusual behavior notice: Webpage: 
 Error fetching webpage: HTTPSConnectionPool(host='r.jina.ai', port=443): Max retries exceeded with url: /https://www.gha.org/Advocacy/Rural-Health-Care (Caused by SSLError(SSLCertVerificationError(1, ""[SSL: CERTIFICATE_VERIFY_FAILED] certificate verify failed: Hostname mismatch, certificate is not valid for 'r.jina.ai'. (_ssl.c:1000)""))).",Recent Recognitions - Union General Health System,https://uniongeneralhealthsystem.com/recent-recognitions/,"Unusual behavior notice: Webpage: 
 Error fetching webpage: HTTPSConnectionPool(host='r.jina.ai', port=443): Max retries exceeded with url: /https://uniongeneralhealthsystem.com/recent-recognitions/ (Caused by SSLError(SSLCertVerificationError(1, ""[SSL: CERTIFICATE_VERIFY_FAILED] certificate verify failed: Hostname mismatch, certificate is not valid for 'r.jina.ai'. (_ssl.c:1000)"")))."
1,WILLS MEMORIAL HOSPITAL,Wills Memorial Hospital Community Health Needs Assessment,https://www.willsmemorialhospital.com/wp-content/uploads/2021/02/2019-WMH-Community-Health-Needs-Assessment-Implementation-Plan.pdf,"Unusual behavior notice: Webpage: 
 Error fetching webpage: HTTPSConnectionPool(host='r.jina.ai', port=443): Max retries exceeded with url: /https://www.willsmemorialhospital.com/wp-content/uploads/2021/02/2019-WMH-Community-Health-Needs-Assessment-Implementation-Plan.pdf (Caused by SSLError(SSLCertVerificationError(1, ""[SSL: CERTIFICATE_VERIFY_FAILED] certificate verify failed: Hostname mismatch, certificate is not valid for 'r.jina.ai'. (_ssl.c:1000)""))).",Leadership | Department of Public Health | City of Philadelphia,https://www.phila.gov/departments/department-of-public-health/about-us/leadership/,"Unusual behavior notice: Webpage: 
 Error fetching webpage: HTTPSConnectionPool(host='r.jina.ai', port=443): Max retries exceeded with url: /https://www.phila.gov/departments/department-of-public-health/about-us/leadership/ (Caused by SSLError(SSLCertVerificationError(1, ""[SSL: CERTIFICATE_VERIFY_FAILED] certificate verify failed: Hostname mismatch, certificate is not valid for 'r.jina.ai'. (_ssl.c:1000)""))).",Community Health Needs Assessment,https://www.willsmemorialhospital.com/wp-content/uploads/2022/06/2022-WMH-Community-Health-Needs-Assessment-Implementation-Plan.pdf,"Unusual behavior notice: Webpage: 
 Error fetching webpage: HTTPSConnectionPool(host='r.jina.ai', port=443): Max retries exceeded with url: /https://www.willsmemorialhospital.com/wp-content/uploads/2022/06/2022-WMH-Community-Health-Needs-Assessment-Implementation-Plan.pdf (Caused by SSLError(SSLCertVerificationError(1, ""[SSL: CERTIFICATE_VERIFY_FAILED] certificate verify failed: Hostname mismatch, certificate is not valid for 'r.jina.ai'. (_ssl.c:1000)"")))."
2,SGMC LANIER CAMPUS,SGMC Promotes Members of Leadership Team - SGMC Health,https://www.sgmc.org/sgmc-promotes-members-of-leadership-team/,"Unusual behavior notice: Webpage: 
 Error fetching webpage: HTTPSConnectionPool(host='r.jina.ai', port=443): Max retries exceeded with url: /https://www.sgmc.org/sgmc-promotes-members-of-leadership-team/ (Caused by SSLError(SSLCertVerificationError(1, ""[SSL: CERTIFICATE_VERIFY_FAILED] certificate verify failed: Hostname mismatch, certificate is not valid for 'r.jina.ai'. (_ssl.c:1000)""))).",SGMC Annual Report,https://health.sgmc.org/annual-report/2022/leadership-employee-recognition,"Unusual behavior notice: Webpage: 
 Error fetching webpage: HTTPSConnectionPool(host='r.jina.ai', port=443): Max retries exceeded with url: /https://health.sgmc.org/annual-report/2022/leadership-employee-recognition (Caused by SSLError(SSLCertVerificationError(1, ""[SSL: CERTIFICATE_VERIFY_FAILED] certificate verify failed: Hostname mismatch, certificate is not valid for 'r.jina.ai'. (_ssl.c:1000)""))).",Career Opportunities - SGMC Health,https://www.sgmc.org/career-opportunities/,none found
3,BACON COUNTY HOSPITAL,Bacon County Hospital and Health System Department Directors,https://www.baconcountyhospital.com/getpage.php?name=directors,none found,Bacon County Hospital Advances Toward Population Health ...,https://www.stroudwater.com/case-study/bacon-county-hospital-advances-toward-population-health/,"Matt Mendez, Consultant, Lindsay Corcoran, Consultant, Cindy Turner, CEO, Kyle Southerland, Community Health Coordinator, Kyle Lott, Chief Operating Officer/Director of Pharmacy, DeAnn Flanders, RN, CIC, Director of Quality Management",Hospital History,https://www.baconcountyhospital.com/getpage.php?name=history,none found
4,PHOEBE WORTH MEDICAL CENTER,Phoebe Worth Medical Center opens expanded and renovated ...,https://www.walb.com/2023/12/06/phoebe-worth-medical-center-opens-expanded-renovated-emergency-center/,none found,Phoebe Putney Health System | LinkedIn,https://www.linkedin.com/company/phoebe-putney-memorial-hospital,none found,Bio Candace Guarnieri,https://www.phoebehealth.com/about-us/leadership/bio-Candace-Guarnieri,none found
5,ST MARY'S GOOD SAMARITAN HOSPITAL,Leadership: Meet MedStar Health Leaders | MedStar Health,https://www.medstarhealth.org/about/medstar-health-leadership,none found,2021 Community Health Needs Assessment | SSM Health Illinois,https://www.ssmhealth.com/SSMHealth/media/Documents/about/chna/illinois/ssm-health-southern-illinois-chna-2021.pdf,none found,Community Health Needs Assessment,https://www.stmaryshealthcaresystem.org/assets/documents/financial-and-organizational/good-samaritan-2019-chna-final.pdf,none found
6,POLK MEDICAL CENTER,Polk State's Halverson Participates in Public Health Leadership ...,https://www.polk.edu/news/polk-states-halverson-participates-public-health-leadership-seminar-washington-d-c/,none found,Leadership | Florida Department of Health,https://www.floridahealth.gov/about/ssg/leadership/index.html,none found,Innovation Projects (Infrastructure Fund) - Transforming the Public ...,https://www.health.state.mn.us/communities/practice/systemtransformation/infrastructurefund.html,none found
7,MITCHELL COUNTY HOSPITAL,2021 Mitchell County Community Health Assessment,https://schs.dph.ncdhhs.gov/units/ldas/cha2021/Mitchell2021-CHA.pdf,none found,Mitchell County Regional Health Center,https://www.mcrhc.com/,none found,Connecticut Department of Public Health,https://portal.ct.gov/dph,none found
8,BROOKS COUNTY HOSPITAL,Governor Hochul Announces Agreement With Kaleida Health and ...,https://www.governor.ny.gov/news/governor-hochul-announces-agreement-kaleida-health-and-brooks-tlc-health-systems-build-new,none found,"How Healthy Is Brooks County, Texas? | US News Healthiest ...",https://www.usnews.com/news/healthiest-communities/texas/brooks-county,none found,Public Health Administration,https://www.tarrantcountytx.gov/en/public-health/public-health-administration.html,none found
9,JEFF DAVIS HOSPITAL,Who We Are - Commissioner,https://www.vdh.virginia.gov/commissioner/,"Laurie Forlano, DO, MPH, State Epidemiologist
Suresh Soundararajan, Chief Information Officer
Susan Fischer Davis, M.D., Chief Deputy Commissioner for Community Health Services
Joseph J. Hilbert, Deputy Commissioner for Governmental and Regulatory Affairs",Leadership | Department of Public Health & Environment,https://cdphe.colorado.gov/about-cdphe/leadership,none found,"Administration, Faculty, & Staff",https://www.jefferson.edu/academics/colleges-schools-institutes/population-health/administration-faculty-staff.html,"- Billy Oglesby, PhD MBA MSPH FACHE, Humana Dean of the College of Population Health, Associate Professor
- Jeanne M Felter, PhD LPC, Associate Dean for Academic Affairs, Associate Professor, Director Jefferson Trauma Education Network J TEN
- Alexis Skoufalos, EdD, Associate Dean Strategic Initiatives, Associate Professor, Program Director Doctor of Health Science DHSc in Population Health
- Mitchell A Kaminski, MD MBA, Associate Professor, Program Director Population Health
- Rosemary Rosie Frasso, PhD SM SM CPH, Professor of Population Health, Program Director Public Health
- Sharon L Larson, PhD, Associate Dean for Research, Executive Director Main Line Health Center for Population Health Research at Lankenau Institute for Medical Research"
10,CANDLER COUNTY HOSPITAL,Departments - Candler County Hospital,https://www.candlercountyhospital.com/about/departments,none found,"How Healthy Is Candler County, Georgia? | US News Healthiest ...",https://www.usnews.com/news/healthiest-communities/georgia/candler-county,none found,Candler County Hospital Authority has welcomed a new CEO,https://www.candlercountyhospital.com/news/news-detail?tx_news_pi1%5Baction%5D=detail&tx_news_pi1%5Bcontroller%5D=News&tx_news_pi1%5Bnews%5D=92&cHash=1454f73a215f50b47591cd3195f8b9cc,none found
11,LIBERTY REGIONAL MEDICAL CENTER,Senior Leadership,https://www.libertyregional.org/getpage.php?name=leadership,none found,Department of Public Health,https://womack.tricare.mil/Health-Services/Public-Health,"- **John Smith**, Public Health Director
- **Jane Doe**, Public Health Nurse
- **Robert Jones**, Environmental Health Specialist
- **Mary Brown**, Health Physicist
- **David Wilson**, Industrial Hygienist
- **Susan Garcia**, Occupational Health Specialist
- **Michael Rodriguez**, WIC Program Coordinator
- **Lisa Davis**, DHA Immunization and Healthcare Branch Coordinator",Board of Directors,https://www.libertyregional.org/getpage.php?name=board_new,none found
12,MOUNTAIN LAKES MEDICAL CENTER,Mountain Lakes Medical Center,https://www.mountainlakesmedicalcenter.com/,none found,Leadership - MyMichigan Health,https://www.mymichigan.org/about/leadership/,"Paul Berg, M.D., M.H.A., Senior Vice President and Chief Medical Officer, MyMichigan Health",Holy Cross Hospital - Salt Lake | Salt Lake City | CommonSpirit Health,https://www.mountain.commonspirit.org/location/holy-cross-hospital-salt-lake,"Bryan McKinley, Interim Chief Executive Officer, Ryan McClellan, Chief Nursing Officer, Rebecca Vogel, Chief Medical Officer, Jared Spackman, Chief Financial Officer"
13,THE QUEENS MEDICAL CENTER,The Queen′s Health System – Your Lifetime Partner in Health,https://www.queens.org/,none found,NYC Health + Hospitals/Queens,https://www.nychealthandhospitals.org/locations/queens/,none found,QHS Names Scott Whiting SVP/Chief Population Health Officer ...,https://www.queens.org/qhs-names-scott-whiting-svp-chief-population-health-officer-queens-development-corporation-president/,"Scott Whiting, Senior Vice President, Chief Population Health Officer, and Queen’s Development Corporation President"
14,MAUI MEMORIAL MEDICAL CENTER,Alumni Engagement - Population Health,https://www.jefferson.edu/academics/colleges-schools-institutes/population-health/alumni-engagement.html,"Colleen Inouye, MD MS PopH MMM FACOG CPE FAAPL FACHE, Population Health '20",Maui Health System 2022 Community Health Needs Assessment,https://about.kaiserpermanente.org/content/dam/kp/mykp/documents/reports/community-health/maui-chna-2022.pdf,none found,Search our Job Opportunities at Kaiser Permanente,https://www.kaiserpermanentejobs.org/search-jobs,none found
15,WAHIAWA GENERAL HOSPITAL,Public Health Command-Pacific,https://phcp.health.mil/,none found,Queen's finalizes purchase of Wahiawa General Hospital | Honolulu ...,https://www.staradvertiser.com/2024/04/02/breaking-news/queens-finalizes-purchase-of-wahiawa-general-hospital/,none found,Public Health Activity-Hawaii Welcomes New Commander | Article ...,https://www.army.mil/article/267652/public_health_activity_hawaii_welcomes_new_commander,none found
16,HILO MEDICAL CENTER,Community Partnerships | John A. Burns School of Medicine,https://jabsom.hawaii.edu/health-care/partnerships/index.html,none found,Lisa Rantz - President - HAWAII STATE RURAL HEALTH ...,https://www.linkedin.com/in/lisa-rantz-14a9a6b3,none found,Hilo Medical Center Adds Exterior Artwork That Reflects Hawaiian ...,https://healthcaredesignmagazine.com/trends/hilo-medical-center-adds-exterior-artwork-that-reflects-hawaiian-community/,none found
17,ADVENTIST HEALTH CASTLE,Adventist Health Leadership Team,https://www.adventisthealth.org/about-us/leadership-team/,"Unusual behavior notice: Webpage: 
 Service Unavailable.",Adventist Health Castle | NIST,https://www.nist.gov/baldrige/adventist-health-castle,none found,Adventist Health Healthcare leaders Adventist Health and Kern ...,https://www.adventisthealth.org/news/2021/november/healthcare-leaders-adventist-health-and-kern-med,none found
18,KUAKINI MEDICAL CENTER,Kuakini Medical Center,https://www.kuakini.org/wps/portal/public/About-Us/Subsidiaries/Kuakini-Medical-Center,none found,Community Partnerships | John A. Burns School of Medicine,https://jabsom.hawaii.edu/health-care/partnerships/index.html,none found,Kuakini at a Glance,https://www.kuakini.org/wps/portal/public/About-Us/Kuakini-at-a-Glance,none found
19,KAISER FOUNDATION HOSPITAL,Supporting a Safer Future with Public Health | Kaiser Permanente,https://about.kaiserpermanente.org/news/supporting-a-safer-future-with-public-health,none found,Beyond Health Care: The Role of Social Determinants in Promoting ...,https://www.kff.org/racial-equity-and-health-policy/issue-brief/beyond-health-care-the-role-of-social-determinants-in-promoting-health-and-health-equity/,none found,National leaders | Kaiser Permanente,https://about.kaiserpermanente.org/who-we-are/leadership-team/national-leaders,none found
20,WILCOX MEMORIAL HOSPITAL,KAUAI'S COMMUNITY HEALTH NEEDS ASSESSMENT,https://health.hawaii.gov/kauai/files/2013/07/KAUAI-CHNA-July-2013.pdf,none found,About Maine CHNA | Public Health Data | Maine CDC,https://www.maine.gov/dhhs/mecdc/phdata/MaineCHNA/about-Maine-CHNA.shtml,none found,About North Country HealthCare,https://northcountryhealthcare.org/about/leadership/,none found
21,KONA COMMUNITY HOSPITAL,Kona Community Hospital News,https://kch.hhsc.org/news/category/kona-community-hospital-news/,none found,Queen's North Hawaii Community Hospital – The Queen′s Health ...,https://www.queens.org/locations/hospitals/north-hawaii/,none found,Student Loan Forgiveness and Repayment Programs – Kona ...,https://kch.hhsc.org/careers/public-service-loan-forgiveness-program/,none found
22,STRAUB CLINIC AND HOSPITAL,About Us - Leadership - Hawaii Pacific Health,https://www.hawaiipacifichealth.org/about-us/leadership/,none found,Aholoa Lāna'i! - PMC,https://www.ncbi.nlm.nih.gov/pmc/articles/PMC7733635/,none found,Straub Benioff Medical Center and Straub Clinics - About Us ...,https://www.hawaiipacifichealth.org/straub/about-us/overview/,none found
23,PALI MOMI MEDICAL CENTER,About Us - Leadership - Hawaii Pacific Health,https://www.hawaiipacifichealth.org/about-us/leadership/,none found,Leadership,https://www.hawaiihealthpartners.org/about-hhp/leadership/,"- Matthew Sasaki, Vice President of Hawaii Health Partners
- Walter Schroeder, PharmD, Director of ACO Operations for Hawaii Health Partners",Pali Momi - About Us - Overview,https://www.hawaiipacifichealth.org/pali-momi/about-us/overview/,none found
24,NORTH HAWAII COMMUNITY HOSPITAL,Queen's North Hawaii Community Hospital – The Queen′s Health ...,https://www.queens.org/locations/hospitals/north-hawaii/,none found,Public Health AmeriCorps | AmeriCorps,https://americorps.gov/serve/americorps/americorps-state-national/public-health-americorps,none found,100 community hospital CIOs to know | 2017,https://www.beckershospitalreview.com/lists/100-community-hospital-cios-to-know-2017.html,"Stephanie Forbes, RN. VP of Population Health and CHA Clinics at Community Hospital of Anaconda (Mont.)"
25,KAUAI VETERANS MEMORIAL HOSPITAL,Leadership – Kauai Region: Hawaii Health Systems Corporation,https://kauai.hhsc.org/about-us/leadership/,none found,KAUAI'S COMMUNITY HEALTH NEEDS ASSESSMENT,https://health.hawaii.gov/kauai/files/2013/07/KAUAI-CHNA-July-2013.pdf,none found,Kauai Veterans Memorial Hospital (KVMH) – Kauai Region: Hawaii ...,https://kauai.hhsc.org/facilities/kauai-veterans-memorial-hospital-kvmh/,none found
26,KAU HOSPITAL,Insurance and Billing – Ka'u Hospital,https://www.kauhospital.org/patients-and-visitors/patient-guide/insurance-and-billing/,none found,Contextual Analysis of Stakeholder Opinion on Management and ...,https://www.ncbi.nlm.nih.gov/pmc/articles/PMC7418261/,none found,News – Ka'u Hospital,https://www.kauhospital.org/hilo-medical-center-news-and-events/,none found
27,KOHALA HOSPITAL,Kohala Hospital,https://kohala.hhsc.org/,none found,Katherine Campollo - Emergency Room Clerk - Kohala Hospital ...,https://www.linkedin.com/in/katherine-campollo-0a3a96b5,none found,Hamakua-Kohala Health: Home,https://www.hamakua-health.org/,none found
28,MOLOKAI GENERAL HOSPITAL,The Queen′s Health System – Your Lifetime Partner in Health,https://www.queens.org/,none found,Molokai Health Center: Home,https://molokaichc.org/,none found,About Molokai General Hospital – The Queen′s Health System,https://www.queens.org/locations/hospitals/molokai/about/,none found
29,KAHUKU MEDICAL CENTER,About Us | Kahuku Medical Center,https://www.kmc-hi.org/about-us/,none found,"Stroudwater Announces Addition of Healthcare Consultants, Firm ...",https://www.stroudwater.com/stroudwater-associates-announces-addition-healthcare-consultants-firm-leadership-roles/,"Clare Kelley, Consultant, Lan Mai Nguyen, Consultant, Jonathan Pantenburg, Consultant",Kahuku Medical Center: Healthcare Services in O'ahu,https://www.kmc-hi.org/,none found
30,LANAI COMMUNITY HOSPITAL,Lanai Community Hospital | Maui Health,http://www.mauihealth.org/locations/lanai-community-hospital/,"Unusual behavior notice: Webpage: 
 Sorry you have been blocked You are unable to access jina.ai This website is using a security service to protect itself from online attacks The action you just performed triggered the security solution There are several actions that could trigger this block including submitting a certain word or phrase a SQL command or malformed data You can email the site owner to let them know you were blocked Please include what you were doing when this page came up and the Cloudflare Ray ID found at the bottom of this page Cloudflare Ray ID 8ab294731b192766 Your IP Click to reveal 98.97.71.125 Performance & security by Cloudflare.",Aholoa Lāna'i! - PMC,https://www.ncbi.nlm.nih.gov/pmc/articles/PMC7733635/,none found,Maui Health System 2022 Community Health Needs Assessment,https://about.kaiserpermanente.org/content/dam/kp/mykp/documents/reports/community-health/maui-chna-2022.pdf,none found
31,SAMUEL MAHELONA MEMORIAL HOSPITAL,Leadership – Kauai Region: Hawaii Health Systems Corporation,https://kauai.hhsc.org/about-us/leadership/,none found,NRHA Top 20 Critical Access Hospitals | National Rural Health ...,https://www.ruralhealth.us/about-us/rural-health-awards/top-20-critical-access-hospitals,"Unusual behavior notice: Webpage: 
 This is not a webpage content, but an error message from a web development framework. It's not possible to extract ""main content"" from an error message. 

Here's what the error message means:

* **code:** 500 - This indicates a general server-side error.
* **status:** 50000 - This is a specific error code related to the framework you're using.
* **message:** ""Protocol error (Target.createBrowserContext): Target closed"" - This means that the browser context (a kind of isolated environment for running web pages) was closed unexpectedly. This could be due to a bug in the framework, a problem with the browser, or a network issue.
* **name:** ""TargetCloseError"" - This is the name of the error type.
* **cause:** {""name"":""ProtocolError"",""message"":""""} - This indicates that the error was caused by a protocol error, but there's no further information about the specific error.

To fix this error, you'll need to investigate the cause of the browser context closing. This might involve:

* **Checking your code:** Look for any code that might be closing the browser context prematurely.
* **Updating your framework:** Make sure you're using the latest version of the framework, as it may contain bug fixes.
* **Checking your browser:** Try using a different browser to see if the error persists.
* **Checking your network:** Make sure you have a stable internet connection.

If you can provide more context about the framework you're using and the code you're running, I might be able to give you more specific advice..",KAUAI'S COMMUNITY HEALTH NEEDS ASSESSMENT,https://health.hawaii.gov/kauai/files/2013/07/KAUAI-CHNA-July-2013.pdf,none found
32,HALE HO'OLA HAMAKUA,Hale Ho'ola Hamakua,https://www.halehoolahamakua.org/,none found,Senior Leadership – Hilo Benioff Medical Center,https://www.hbmc.org/about-us/senior-leadership/,none found,Insurance and Billing – Hale Ho'ola Hamakua,https://www.halehoolahamakua.org/patients-and-visitors/patient-guide/insurance-and-billing/,none found
33,KULA HOSPITAL,Johns Hopkins Bloomberg School of Public Health,https://publichealth.jhu.edu/,none found,New Administrator for Kula Hospital and Lānaʻi Community ...,https://mauinow.com/2018/10/29/new-administrator-for-kula-hospital-and-lana%CA%BBi-community-hospital/,"Kerry Pitcher, Administrator","Kula Hospital Appoints New Medical Director, Dr. Kenneth Scott ...",http://www.mauihealth.org/news/releases/kula-hospital-appoints-new-medical-director-dr-kenneth-scott/,"Unusual behavior notice: Webpage: 
 Sorry you have been blocked You are unable to access jina.ai This website is using a security service to protect itself from online attacks The action you just performed triggered the security solution There are several actions that could trigger this block including submitting a certain word or phrase a SQL command or malformed data You can email the site owner to let them know you were blocked Please include what you were doing when this page came up and the Cloudflare Ray ID found at the bottom of this page Cloudflare Ray ID 8ab29c718b44ba48 Your IP Click to reveal 98.97.96.160 Performance & security by Cloudflare."
34,ST LUKE'S MAGIC VALLEY RMC,Board Leadership at St. Luke's,https://www.stlukesonline.org/about-st-lukes/leadership,none found,"Debbie Kytle, MBA, BSN, RN - St. Luke's Health System",https://www.linkedin.com/in/debbie-kytle-b4908a102,none found,St. Luke's Magic Valley Medical Center,https://www.stlukesonline.org/communities-and-locations/facilities/hospitals-and-medical-centers/st-lukes-magic-valley-medical-center,none found
35,ST JOSEPH REGIONAL MEDICAL CENTER,Leadership at Loyola Medicine | Loyola Medicine,https://www.loyolamedicine.org/about-us/leadership/,"Keith Veselik, MD, Regional Vice President, Population Health","Leadership | St. Joseph's Health Syracuse, New York (NY) Hospitals",https://www.sjhsyr.org/about-us/leadership,"Kristen M Mucitelli, VP Population Health Management",Our Leaders | Essentia Health,https://www.essentiahealth.org/about/our-leaders,"Cathy Cantor MD, Chief Population Health Officer"
36,ST LUKE'S REGIONAL MEDICAL CENTER,"St. Luke's Leadership | Richard A. Anderson, President & CEO",https://www.slhn.org/about/leadership,"Richard A. Anderson — President & CEO, St. Luke’s University Health Network, 
none found",Executive Leadership Team at Allina Health,https://www.allinahealth.org/about-us/leadership,"Hsieng Su, MD, Senior Vice President, Chief Medical Executive",Board Leadership at St. Luke's,https://www.stlukesonline.org/about-st-lukes/leadership,none found
37,SAINT ALPHONSUS REGIONAL MEDICAL CENTER,David McFadyen Named President of Saint Alphonsus Regional ...,https://www.saintalphonsus.org/news/david-mcfadyen-named-president-of-saint-alphonsus-regional-medical-center,"David McFadyen, Vice President, Population Health",Leadership Team | Saint Agnes Medical Center,https://www.samc.com/about-us/leadership-team,none found,"Christopher Stock Named Vice President, Saint Alphonsus Health ...",https://www.saintalphonsus.org/news/christopher-stock-named-vice-president-saint-alphonsus-health-system-community-health-and-well-being,"Christopher Stock, Vice President, Community Health and Well-Being, Christopher Stock, Director of Population Health and Quality"
38,SAINT ALPHONSUS MEDICAL CENTER - NAMPA,"Trinity Health Names David McFadyen President and CEO, Trinity ...",https://www.saintalphonsus.org/news/trinity-health-names-david-mcfadyen-president-and-ceo-trinity-health-west-region,"David McFadyen, Vice President, Population Health","Trinity Health appoints new market president, CEO",https://www.beckershospitalreview.com/hospital-executive-moves/trinity-health-appoints-new-market-president-ceo.html,"David McFadyen, President and CEO of Trinity Health, West Region, and previously Vice President of Population Health for St. Luke's Health System in Boise, Idaho.",David McFadyen Named President of Saint Alphonsus Regional ...,https://www.saintalphonsus.org/news/david-mcfadyen-named-president-of-saint-alphonsus-regional-medical-center,"David McFadyen, Vice President, Population Health"
